{
    "annotations": [
        {
            "annotation_metadata": {
                "annotation_tools": "Sonic Visualizer",
                "curator": {
                    "name": "Eric Humphrey",
                    "email": "ejhumphrey@nyu.edu"
                },
                "version": "75ae8948ca1",
                "corpus": "examples",
                "data_source": "thin air"
            },
            "sandbox": {},
            "observations": [
                {
                    "type": "interval",
                    "time": 0.0,
                    "duration": 1.58,
                    "value": "N",
                    "namespace": "chords.harte",
                    "confidence": 1.0
                },
                {
                    "type": "interval",
                    "time": 1.58,
                    "duration": 3.171,
                    "value": "vi",
                    "namespace": "chords.roman",
                    "confidence": 1.0
                },
                {
                    "type": "interval",
                    "time": 1.58,
                    "duration": 0.0,
                    "value": "1",
                    "namespace": "beat",
                    "confidence": 1.0
                },
                {
                    "type": "series",
                    "time": 1.58,
                    "duration": 3.446,
                    "values": [ 440.0, 466.2, 493.9, 523.3, 554.4, 587.3,
                                622.3, 659.3, 698.5, 740.0, 784.0, 830.6 ],
                    "namespace": "melody.hertz",
                    "confidence": 1.0
                }
            ]
        }
    ],
    "file_metadata": {
        "identifiers": {
            "musicbrainz": "11c2f2dc-80f4-4d19-8d19-ab5195bf322f"
        },
        "artist": "The National",
        "title": "I Should Live In Salt",
        "release": "Trouble Will Find Me",
        "duration": 249.0
    },
    "jams_version": "0.0.2",
    "sandbox": {}
}
